Code switched query,High level class,Lower level class
Nanna swiggy order yavaga barutte,SWIGGY,ORDER
When will I get my swiggy order,SWIGGY,ORDER
Swiggy order yavaga barutte,SWIGGY,ORDER
Swiggy order cancel hege maduvudu,SWIGGY,ORDER
Swiggy order cancel maduvudu hege,SWIGGY,ORDER
Hege cancel madli swiggy order na,SWIGGY,ORDER
how to find if swiggy order place agidya anta,SWIGGY,ORDER
how to edit my ordering on swiggy place madida mele,SWIGGY,ORDER
order admele duise edit dure,SWIGGY,ORDER
"after placing food order on swiggy, edit hege madodu",SWIGGY,ORDER
after placing swiggy order edit madboda,SWIGGY,ORDER
after placing swiggy order edit hege madodu,SWIGGY,ORDER
can swiggy order be edited order hakidamele ,SWIGGY,ORDER
swiggy order admele can you edit,SWIGGY,ORDER
can I place food order call madi,SWIGGY,ORDER
call madi food order madboda on swiggy,SWIGGY,ORDER
can I call and order oota on swiggy,SWIGGY,ORDER
how to confirm ootada order on swiggy,SWIGGY,ORDER
naanu call madi food on swiggy order madabahuda,SWIGGY,ORDER
how do I cancel nanna order on swiggy,SWIGGY,ORDER
swiggy ali order cancel hege madbeku torisu,SWIGGY,ORDER
swiggy ali food order cancel hege madodu,SWIGGY,ORDER
can I cancel my ootada order in swiggy,SWIGGY,ORDER
show me the steps to cancel nanna ootada order on swiggy,SWIGGY,ORDER
where to find if my swiggy order is confirmed atava ila,SWIGGY,ORDER
namma order on swiggy cancel madabahuda,SWIGGY,ORDER
where do I edit swiggy du orders after placing it,SWIGGY,ORDER
"after placing ootada order, aduna cancel henge madodu",SWIGGY,ORDER
"after placing food order, aduna cancel mado steps enu",SWIGGY,ORDER
I want to cancel my ootada du order on swiggy,SWIGGY,ORDER
I want to edit my oota da order on swiggy,SWIGGY,ORDER
I want to change my ootada order on swiggy,SWIGGY,ORDER
show me the steps to edit my ootada order on swiggy,SWIGGY,ORDER
can you show me the steps of how to edit my ootada order on swiggy,SWIGGY,ORDER
can you show me the steps of how to cancel my ootada order on swiggy,SWIGGY,ORDER
can you show me the steps of how to confirm my ootada order on swiggy,SWIGGY,ORDER
naanu nanna order on swiggy cancel madbeku anta idini,SWIGGY,ORDER
naanu nanna food order on swiggy cancel madbeku,SWIGGY,ORDER
swiggy food order confirmed agide anta hege aruck madodu,SWIGGY,ORDER
order on swiggy be cancelled madabahuda,SWIGGY,ORDER
order on swiggy be edited madabahuda,SWIGGY,ORDER
order on swiggy be change madbahuda,SWIGGY,ORDER
ootada order on swiggy be cancel madidre fine biluta,SWIGGY,ORDER
order on swiggy be change madboda,SWIGGY,ORDER
ootada order on swiggy can be cancelled,SWIGGY,ORDER
can ootada order on swiggy be placed on a call,SWIGGY,ORDER
can I phone and order oota on swiggy,SWIGGY,ORDER
call madi food order on swiggy order mado option idya,SWIGGY,ORDER
phone madi hotel ge food on swiggy be ordered,SWIGGY,ORDER
namma order swiggy ali edit madboda,SWIGGY,ORDER
call ali naavu namma order on swiggy gedboda,SWIGGY,ORDER
order madidamele edit hege madodu,SWIGGY,ORDER
can I place food order phone madi,SWIGGY,ORDER
can I order food in swiggy phone madi,SWIGGY,ORDER
phone madi food order gedboda swiggy app ali,SWIGGY,ORDER
hege confirm madodu food order on swiggy,SWIGGY,ORDER
How do I know nanna swiggy order confirmed agide,SWIGGY,ORDER
How do I know nanna swiggy du order confirm agide,SWIGGY,ORDER
How do I know nanna ootada order is confirmed or not,SWIGGY,ORDER
where do I cancel swiggy ke orders after placing it,SWIGGY,ORDER
hege naanu order place madli swiggy app ali,SWIGGY,ORDER
swiggy ali ondu order place madake steps helu,SWIGGY,ORDER
when will my order be delivered,SWIGGY,DELIVERY
nanna oota yavaga deliver aaguthe,SWIGGY,DELIVERY
nanna oota deliver yavaga aaguthe helu,SWIGGY,DELIVERY
estu hotu aguthe for my food to be delivered,SWIGGY,DELIVERY
estu time beku for swiggy delivery,SWIGGY,DELIVERY
estu time ali swiggy delivery aaguthe,SWIGGY,DELIVERY
yavaga nanna swiggy delivery aaguthe,SWIGGY,DELIVERY
nanna oota delivery ge estu time beku,SWIGGY,DELIVERY
when will my oota be delivered,SWIGGY,DELIVERY
nanna oota yavaga barute from swiggy delivery,SWIGGY,DELIVERY
henge aruck madodu ki delivery is free or not,SWIGGY,DELIVERY
how to find if nanna delivery in swiggy is free or not,SWIGGY,DELIVERY
how to find if nanna ootada delivery in swiggy is free or not,SWIGGY,DELIVERY
henge gotagute if my swiggy delivery if free or not,SWIGGY,DELIVERY
will nanna swiggy delivery happen the same day,SWIGGY,DELIVERY
will swiggy delivery happen ivate,SWIGGY,DELIVERY
nanna oota from swiggy delivery come onde dinadali baruta,SWIGGY,DELIVERY
does ootada du delivery happen within a day on swiggy,SWIGGY,DELIVERY
will my entire swiggy order come onde delivery ali,SWIGGY,DELIVERY
will nanna purti delivery come in a single packet,SWIGGY,DELIVERY
will multiple swiggy deliveries happen onde dinadali,SWIGGY,DELIVERY
can I change my delivery address on swiggy,SWIGGY,DELIVERY
delivery ali address change madboda,SWIGGY,DELIVERY
can I change nanna delivery address on swiggy,SWIGGY,DELIVERY
nannu nanna delivery address on swiggy change madabahuda,SWIGGY,DELIVERY
can I change my delivery address on swiggy call madi,SWIGGY,DELIVERY
call madi can I change my delivery address on swiggy,SWIGGY,DELIVERY
torisu the steps to track the swiggy delivery,SWIGGY,DELIVERY
steps torisu to track the swiggy delivery,SWIGGY,DELIVERY
show me the steps to track my ootada delivery on swiggy,SWIGGY,DELIVERY
what to do if i have problem with nanna delivery from swiggy,SWIGGY,DELIVERY
eli complain madbeku if i have a problem with delivery,SWIGGY,DELIVERY
where to lodge complain for swiggy delivery,SWIGGY,DELIVERY
torisu steps to lodge complain on swiggy delivery,SWIGGY,DELIVERY
why is swiggy not servicable nanna address hatra,SWIGGY,DELIVERY
estu time aguthe for my food to be delivered,SWIGGY,DELIVERY
estu hotu aguthe for a swiggy delivery,SWIGGY,DELIVERY
est time beku for a food delivery from swiggy,SWIGGY,DELIVERY
deliveries on swiggy free gedtara,SWIGGY,DELIVERY
free deliveries gedtara on swiggy,SWIGGY,DELIVERY
food deliveries free na on swiggy,SWIGGY,DELIVERY
how to aruck if my swiggy delivery is uchita or not,SWIGGY,DELIVERY
deliveries on swiggy uchita na anta hege gotagute,SWIGGY,DELIVERY
steps torisu bega to track my swiggy delivery on the app,SWIGGY,DELIVERY
can i set time for my delivery on swiggy,SWIGGY,DELIVERY
time set madboda for swiggy delivery,SWIGGY,DELIVERY
delivery time set madboda swiggy app ali,SWIGGY,DELIVERY
nanna delivery ge time set hege madodu,SWIGGY,DELIVERY
delivery time hege set madodu torisu,SWIGGY,DELIVERY
hege swiggy delivery madtare,SWIGGY,DELIVERY
swiggy ali delivery hege madtare,SWIGGY,DELIVERY
can you pay at the time of delivery swiggy ali,SWIGGY,DELIVERY
can you pay at the time of delivery swiggy par,SWIGGY,DELIVERY
delivery  time ali cash accept agutha on swiggy,SWIGGY,DELIVERY
will my swiggy delivery be handled with care atva illa,SWIGGY,DELIVERY
swiggy delivery ge duddu gedbedu,SWIGGY,DELIVERY
swiggy delivery ge duddu gedbedu uchita na,SWIGGY,DELIVERY
swiggy ali food order madidre delivery free na,SWIGGY,DELIVERY
swiggy ali payment yavaga madbeku,SWIGGY,PAYMENT
when do i have to pay swiggy ali,SWIGGY,PAYMENT
yava payment mode accept aguthe on swiggy,SWIGGY,PAYMENT
is only card accepted on swiggy atava cash only,SWIGGY,PAYMENT
is only cash accepted on swiggy atava card also accept aguthe,SWIGGY,PAYMENT
is only cash accepted on swiggy atava card also accept aguthe,SWIGGY,PAYMENT
naanu credit card ali food order madboda on swiggy,SWIGGY,PAYMENT
naanu debit card ali food order madboda on swiggy,SWIGGY,PAYMENT
naanu sodexo card ali food order madboda on swiggy,SWIGGY,PAYMENT
is credit card accepted on swiggy atava ila for payment,SWIGGY,PAYMENT
is debit card accepted on swiggy atava ila for payment,SWIGGY,PAYMENT
is sodexo card accepted on swiggy atava ila for payment,SWIGGY,PAYMENT
paytm payment option idya on swiggy,SWIGGY,PAYMENT
phonepay payment option idya on swiggy,SWIGGY,PAYMENT
googlepay payment option idya on swiggy,SWIGGY,PAYMENT
amazonpay payment option idya on swiggy,SWIGGY,PAYMENT
freecharge payment option idya on swiggy,SWIGGY,PAYMENT
mobiquick payment option idya on swiggy,SWIGGY,PAYMENT
sodexo payment option idya on swiggy,SWIGGY,PAYMENT
swiggy payment helpline number hudku,SWIGGY,PAYMENT
freecharge du payment invoice swiggy yeli sigute,SWIGGY,PAYMENT
payment clarifications from swiggy ge yarige call madbeku,SWIGGY,PAYMENT
swiggy du payment helpline number hudku ,SWIGGY,PAYMENT
what to do eradu sati payment cut adre on swiggy,SWIGGY,PAYMENT
payment refund agila from swiggy,SWIGGY,PAYMENT
payment refund agila from swiggy what to do,SWIGGY,PAYMENT
nanna purti payment refund agutha on swiggy,SWIGGY,PAYMENT
payment invoice yeli siguthe on swiggy app,SWIGGY,PAYMENT
nange swiggy ali payment chalaan yeli siguthe,SWIGGY,PAYMENT
paytm chalaan swiggy ali yeli siguthe,SWIGGY,PAYMENT
yavaga nanna payment refund siguthe from swiggy,SWIGGY,PAYMENT
est time aguthe for payment refund on swiggy,SWIGGY,PAYMENT
est samaya aguthe for payment refund on swiggy,SWIGGY,PAYMENT
if i receive bad goods on swiggy andre will i get my refund of full payment,SWIGGY,PAYMENT
if i receive wrong goods on swiggy andre will i get my refund of full payment,SWIGGY,PAYMENT
if i get damaged goods on swiggy andre will i get my refund of full payment,SWIGGY,PAYMENT
payment chaalaan yeli siguthe on swiggy,SWIGGY,PAYMENT
google pay invoice swiggy ali yeli siguthe,SWIGGY,PAYMENT
amazon pay invoice swiggy yeli siguthe app ali,SWIGGY,PAYMENT
payment invoice yeli siguthe on swiggy app,SWIGGY,PAYMENT
e-aadhaar hege download maduvudu,AADHAAR,E_AADHAAR
Online e-aadhaar hege padeyuvudu,AADHAAR,E_AADHAAR
e-aadhaar access hege maduvudu,AADHAAR,E_AADHAAR
How to download e-aadhaar ,AADHAAR,E_AADHAAR
e-aadhaar hege access maduvudu,AADHAAR,E_AADHAAR
e-aadhaar download madu,AADHAAR,E_AADHAAR
hege I can get e-aadhaar,AADHAAR,E_AADHAAR
Nanage e-aadhaar download madabeku,AADHAAR,E_AADHAAR
Online nalli aadhaar hege padeyuvudu,AADHAAR,E_AADHAAR
Internet ninda aadhaar hege padeyuvudu,AADHAAR,E_AADHAAR
e-aadhaar download maduvudu hege,AADHAAR,E_AADHAAR
how to get aadhaar bega,AADHAAR,E_AADHAAR
quickly aadhaar hege siguttade,AADHAAR,E_AADHAAR
how can i get aadhaar jaldi,AADHAAR,E_AADHAAR
what is e-aadhaar,AADHAAR,E_AADHAAR
e-aadhaar du use enu,AADHAAR,E_AADHAAR
e-aadhaar na use hege maduvudu,AADHAAR,E_AADHAAR
download madu e-aadhaar na,AADHAAR,E_AADHAAR
e-aadhaar hege upayogisuvudu,AADHAAR,E_AADHAAR
e-aadhaar na verify hege maduvudu,AADHAAR,E_AADHAAR
how can I aruck e-aadhaar sari idiya ilva,AADHAAR,E_AADHAAR
nanage online inda aadhaar hege siguttade,AADHAAR,E_AADHAAR
e-aadhaar ge how can I get,AADHAAR,E_AADHAAR
e-aadhaar hege open aagutte,AADHAAR,E_AADHAAR
e-aadhaar use maduvudakke what can i do,AADHAAR,E_AADHAAR
what can I use e-aadhaar open maduvudakke,AADHAAR,E_AADHAAR
e-aadhaar access maduvudakke yava software use madabeku,AADHAAR,E_AADHAAR
which software use madabeku e-aadhaar open maduvudakke,AADHAAR,E_AADHAAR
how to get upayoga of e-aadhaar,AADHAAR,E_AADHAAR
e-aadhaar hege open maduvudu,AADHAAR,E_AADHAAR
yava software beku e-aadhaar open maduvudakke,AADHAAR,E_AADHAAR
which software can I use e-aadhaar open maduvudakke,AADHAAR,E_AADHAAR
yava software e-aadhaar open maduttade,AADHAAR,E_AADHAAR
which software inda e-aadhaar tereyuttade,AADHAAR,E_AADHAAR
nanage e-aadhaar hege tereyuvudu torisu,AADHAAR,E_AADHAAR
help beku nanage to open e-aadhaar ,AADHAAR,E_AADHAAR
how to get pakdu e-aadhaar sari ide anta,AADHAAR,E_AADHAAR
how can I get pakdu that e-aadhaar correct ide anta,AADHAAR,E_AADHAAR
hege aruck madali e-aadhaar correct ide anta,AADHAAR,E_AADHAAR
what is e-aadhaar du upayoga,AADHAAR,E_AADHAAR
e-aadhaar na upayoga enu,AADHAAR,E_AADHAAR
physical aadhaar and e-aadhaar madya antara enu,AADHAAR,E_AADHAAR
 physical aadhaar and e-aadhaar bere bere na,AADHAAR,E_AADHAAR
e-aadhaar and physical aadhaar ali antara idya,AADHAAR,E_AADHAAR
 e-aadhaar mathe physical aadhaar onde na,AADHAAR,E_AADHAAR
e-aadhaar mathe physical aadhaar onde na bere bere na,AADHAAR,E_AADHAAR
 e-aadhaar mathe physical aadhaar same aa,AADHAAR,E_AADHAAR
aruck maduodu hege if nanna e-aadhaar correct ide,AADHAAR,E_AADHAAR
verify nanna e-aadhaar,AADHAAR,E_AADHAAR
how can I aruck e-aadhaar correct idya,AADHAAR,E_AADHAAR
e-aadhaar validate hege madli,AADHAAR,E_AADHAAR
what is e-aadhaar du password,AADHAAR,E_AADHAAR
nange e-aadhaar du password beku,AADHAAR,E_AADHAAR
e-aadhaar ge password idya,AADHAAR,E_AADHAAR
Can I get my Aadhaar letter download online after updation,AADHAAR,UPDATE
 naanu updation admele nanna aadhaar patra online download madboda,AADHAAR,UPDATE
naanu aadhaar online update hege madli,AADHAAR,UPDATE
 naanu aadhaar online update mathe download eli madli,AADHAAR,UPDATE
Can I get my Aadhaar letter download online updation admele,AADHAAR,UPDATE
Can I get nanna updated Aadhaar online,AADHAAR,UPDATE
Can I get nanna updated Aadhaar patra online,AADHAAR,UPDATE
can i download nanna update aadhaar patra online,AADHAAR,UPDATE
naanu updation admele nanna aadhaar patra online hege padeyali,AADHAAR,UPDATE
where can i get nanna updated aadhaar online patra,AADHAAR,UPDATE
duhaan se updated online aadhaar patra sigute,AADHAAR,UPDATE
 updation admele nanage wapas aadhaar patra hege sigute,AADHAAR,UPDATE
after updation  nanage wapas se aadhaar patra hege sigute,AADHAAR,UPDATE
 updation admele will i get new aadhaar card,AADHAAR,UPDATE
hege updated aadhaar card sigute,AADHAAR,UPDATE
yelinda updated aadhaar card sigute,AADHAAR,UPDATE
updated aadhaar card yelinda prapta aguthe,AADHAAR,UPDATE
will i get a hosa aadhaar card on updation,AADHAAR,UPDATE
hosa aadhaar card hege sigute after updation,AADHAAR,UPDATE
aadhaar updation agake estu samaya aguthe,AADHAAR,UPDATE
aadhaar updation agake estu time beduguthe,AADHAAR,UPDATE
how long does it take aadhaar card updation agake,AADHAAR,UPDATE
how much time does it take for aadhaar card updation agake,AADHAAR,UPDATE
aadhaar card updation agake how long does it take ,AADHAAR,UPDATE
estu hotu aguthe aadhaar card updation agake,AADHAAR,UPDATE
 aadhaar updation admele will my number change,AADHAAR,UPDATE
after updating aadhaar will my number change,AADHAAR,UPDATE
I have my mobile number registered in Aadhaar patra I want to change it with my second number idu online madboda,AADHAAR,UPDATE
I have my mobile number registered in Aadhaar but I want to update it with my innodu number  online madboda,AADHAAR,UPDATE
I have ondu mobile number registered in Aadhaar patra I want to change it with innondu number,AADHAAR,UPDATE
 aadhaar ali number update hege madodu,AADHAAR,UPDATE
 aadhaar ali name du spelling update madboda,AADHAAR,UPDATE
 aadhaar ali address change madboda,AADHAAR,UPDATE
can i update mane address on aadhaar,AADHAAR,UPDATE
can i change nanna hesaru on aadhaar,AADHAAR,UPDATE
can i update nanna address on aadhaar,AADHAAR,UPDATE
 fields can be updated on aadhaar?,AADHAAR,UPDATE
yava fields on an aadhar card can be changed,AADHAAR,UPDATE
 aadhaar fields update madake fees gedbedu,AADHAAR,UPDATE
what is the fee for updating mane address on aadhaar card,AADHAAR,UPDATE
 aadhaar card details updation madake estu fess gedbeku,AADHAAR,UPDATE
 aadhaar vivaran ali updation ge fess idya,AADHAAR,UPDATE
 aadhaar card details ali change madsboda,AADHAAR,UPDATE
what is the fee for updating  mane address on aadhaar card,AADHAAR,UPDATE
yava details i can update on aadhaar card if I am visiting Permanent Enrolment centre ,AADHAAR,UPDATE
What details can I get updated on aadhaar if I am visiting Permanent Enrolment centre ,AADHAAR,UPDATE
nanna mobile number registered agirbedu with Aadhaar while requesting for any kind of updation,AADHAAR,UPDATE
Is it necessary ki nanna mobile number should be registered with Aadhaar while requesting for any kind of updation,AADHAAR,UPDATE
yava supporting documents are needed for updating aadhaar card,AADHAAR,UPDATE
yava supporting documents important ide for updating aadhaar card,AADHAAR,UPDATE
 aadhaar ali biometrics update madboda,AADHAAR,UPDATE
 aadhaar ali fingerprints update madboda,AADHAAR,UPDATE
 aadhaar ali fingerprints update madboda,AADHAAR,UPDATE
 aadhaar ali photograph update madboda,AADHAAR,UPDATE
 aadhaar ali photograph change madboda,AADHAAR,UPDATE
 aadhaar ali iris change madboda,AADHAAR,UPDATE
 aadhaar ali iris du picture change madboda,AADHAAR,UPDATE
Do I need to visit same enrolment centre for aadhar updation eli nanna original enrolment was done,AADHAAR,UPDATE
Do I need to visit same enrolment centre for aadhar updation eli modlu it was done,AADHAAR,UPDATE
Does submission of request guarantee pakdu updation of information in aadhaar,AADHAAR,UPDATE
aadhaar card  enu,AADHAAR,FEATURES
aadhaar patra  enu,AADHAAR,FEATURES
aadhaar card yaake beku,AADHAAR,FEATURES
 aadhar card important na ,AADHAAR,FEATURES
should all Indian citizens have aadhaar patra,AADHAAR,FEATURES
should all bhaarateey nagarik have aadhaar card,AADHAAR,FEATURES
 yella bhaarateey naigarigen hatra aadhaar card irbedu,AADHAAR,FEATURES
yellar hatra aadhaar card irbedu,AADHAAR,FEATURES
aadhaar card irodu compulsory na ,AADHAAR,FEATURES
 uses enu aadhaar card du,AADHAAR,FEATURES
torisu eligibility criteria for aadhar card,AADHAAR,FEATURES
torisu steps to apply for aadhar card,AADHAAR,FEATURES
 supporting documents bedu for applying a aadhaar card,AADHAAR,FEATURES
 NRI gu aadhaar card applicable idya,AADHAAR,FEATURES
benefits  idya aadhaar card du,AADHAAR,FEATURES
aadhaar praapt madake estu hotu beku,AADHAAR,FEATURES
aadhaar authentication  hege madodu,AADHAAR,FEATURES
benefits  enu for authenticating aadhaar card,AADHAAR,FEATURES
 Aadhaar different idya from any other identity issued by the government,AADHAAR,FEATURES
aadhaar mathe pan card different na ,AADHAAR,FEATURES
aadhaar mathe passport same na ,AADHAAR,FEATURES
is aadhaar patra and pan card same,AADHAAR,FEATURES
estu digit iruthe aadhaar number,AADHAAR,FEATURES
 aadhaar card authentication ali involve agutha OTP,AADHAAR,FEATURES
 NRI aadhaar card ge apply hege madli,AADHAAR,FEATURES
 nanna international number aadhaar card ge use madboda,AADHAAR,FEATURES
torisu process for NRI to apply for aadhaar ,AADHAAR,FEATURES
 passport mathe aadhaar ali addres same irbedu,AADHAAR,FEATURES
torisu process for NRI aadhaar enrollment,AADHAAR,FEATURES
how many aadhaar seva kendra are outside india,AADHAAR,FEATURES
how many aadhaar seva kendra are in india,AADHAAR,FEATURES
Can I update my Aadhaar at Aadhaar Seva Kendra,AADHAAR,FEATURES
What are the timings of Aadhaar Seva Kendra,AADHAAR,FEATURES
Are the services charges different for Aadhaar Seva Kendra,AADHAAR,FEATURES
can i lodge complain at aadhaar seva kendra,AADHAAR,FEATURES
Is the Aadhaar centre at my nearby bank also an Aadhaar Seva Kendra,AADHAAR,FEATURES
Is the Aadhaar centre at my post office also an Aadhaar Seva Kendra,AADHAAR,FEATURES
What is the service process at Aadhaar Seva Kendra,AADHAAR,FEATURES
Swine flu na symptoms enu?,MEDICAL,SYMPTOMS
What are the lakshana of coronavirus?,MEDICAL,SYMPTOMS
Coronavirus na symptoms enu,MEDICAL,SYMPTOMS
Dengue na symptoms enu,MEDICAL,SYMPTOMS
nanage dengue na symptoms hege gottagutte,MEDICAL,SYMPTOMS
What are the prabhaavaa of dengue,MEDICAL,SYMPTOMS
enu effects ide of coronavirus,MEDICAL,SYMPTOMS
How can i aruck nanage Coronavirus ide na ilva,MEDICAL,SYMPTOMS
hege aruck madali for coronavirus,MEDICAL,SYMPTOMS
Symptoms enu coronavirus ge,MEDICAL,SYMPTOMS
What are the prabhaava of coronavirus,MEDICAL,SYMPTOMS
Coronavirus na arucking hege maduvudu,MEDICAL,SYMPTOMS
How can I know the prabhaava of coronavirus,MEDICAL,SYMPTOMS
How can I know the prabhaava of dengue,MEDICAL,SYMPTOMS
How can I know the prabhaava of swine flu,MEDICAL,SYMPTOMS
Swine flu na effects enu,MEDICAL,SYMPTOMS
Swine flu na arucking hege maduvudu,MEDICAL,SYMPTOMS
How can I aruck nanage swine flu ideya ilva,MEDICAL,SYMPTOMS
Symptoms enu coronavirus ge,MEDICAL,SYMPTOMS
What are the coronavirus ge parinama,MEDICAL,SYMPTOMS
What are the dengue ge parinama,MEDICAL,SYMPTOMS
Malaria ge effects enu,MEDICAL,SYMPTOMS
Dengue ge effects enu,MEDICAL,SYMPTOMS
Swine flu ge effects enu,MEDICAL,SYMPTOMS
Coronavirus ge effects enu,MEDICAL,SYMPTOMS
Malaria na arucking hege aagutte,MEDICAL,SYMPTOMS
How can I know nanage malaria hua ide athava illava,MEDICAL,SYMPTOMS
What are the parinama of malaria,MEDICAL,SYMPTOMS
What are the parinama of swine flu,MEDICAL,SYMPTOMS
How can I know the prabhaava of malaria,MEDICAL,SYMPTOMS
nanage malaria na symptoms enu ide tell,MEDICAL,SYMPTOMS
What are the coronavirus na parinama,MEDICAL,SYMPTOMS
I want to know malaria na hege aruck madodu anta,MEDICAL,SYMPTOMS
When will the symptoms of coronavirus dunisigellau shuru agutte,MEDICAL,SYMPTOMS
When will the parinama of coronavirus start to show,MEDICAL,SYMPTOMS
Common cold mattu coronavirus na symptoms estu different ide,MEDICAL,SYMPTOMS
Malaria and coronavirus na parinama estu different ide,MEDICAL,SYMPTOMS
How different are the prabhaava of coronavirus and malaria,MEDICAL,SYMPTOMS
Symptoms of coronavirus and malaria estu different ide,MEDICAL,SYMPTOMS
Swine flu and coronavirus na symptoms estu bhinnavagide,MEDICAL,SYMPTOMS
nanage common cold na symptons nodabeku,MEDICAL,SYMPTOMS
What are the parinama of common cold,MEDICAL,SYMPTOMS
Common cold na effect enu,MEDICAL,SYMPTOMS
Common cold na symptoms enu,MEDICAL,SYMPTOMS
How different are the prabhaava of common cold and malaria,MEDICAL,SYMPTOMS
Coronavirus na effects common cold ginta estu different ide,MEDICAL,SYMPTOMS
headaaru coronavirus na ondu symptom idena,MEDICAL,SYMPTOMS
Is headaaru one of the parinama of coronavirus,MEDICAL,SYMPTOMS
headaaru malaria da ondu symptom idena,MEDICAL,SYMPTOMS
Is headaaru one of the parinama of malaria,MEDICAL,SYMPTOMS
Is high fever one of the parinama of swine flu,MEDICAL,SYMPTOMS
Headaaru mattu high fever yavudara symptom ide,MEDICAL,SYMPTOMS
"Headaaru, fever mattu vomitting yavudara symptoms ide",MEDICAL,SYMPTOMS
"Vomitting, fever, headaaru yava disease ge symptoms ide",MEDICAL,SYMPTOMS
Which disease na parinama headaaru ide,MEDICAL,SYMPTOMS
How different are the prabhaava of common cold and swine flu,MEDICAL,SYMPTOMS
Vomitting and headaaru yavudara symptoms ide,MEDICAL,SYMPTOMS
Coronavirus na arucking headaaru confirm maduttade enu,MEDICAL,SYMPTOMS
Cornavirus and common flu ge lakshana estu different ide,MEDICAL,SYMPTOMS
Swine flu mattu common cold ge lakshana estu different ide,MEDICAL,SYMPTOMS
Headaaru ondu symptom ide enu coronavirus du,MEDICAL,SYMPTOMS
Coronavirus na arucking headaaru confirm maduttade enu,MEDICAL,SYMPTOMS
corona virus na treatment enu,MEDICAL,TREATMENT
dengue hege treat maduvdu,MEDICAL,TREATMENT
headaaru na jaldi cikitse hege maduvudu,MEDICAL,TREATMENT
malaria na cikitse enu,MEDICAL,TREATMENT
nauseousness annu treat hege maduvudu,MEDICAL,TREATMENT
itching throat na immediate cikitse enu ide,MEDICAL,TREATMENT
nanage dengue ide how to treat it,MEDICAL,TREATMENT
i have swine flu idara cikitse ide enu,MEDICAL,TREATMENT
immediate treatment for food poisoning enu ide,MEDICAL,TREATMENT
torisu heart attack patient annu treat hege maduvudu,MEDICAL,TREATMENT
how to treat patient yarige dengue ide,MEDICAL,TREATMENT
how to treat a patient yarige malaria ide,MEDICAL,TREATMENT
how to treat a patient yarige jaundice ide,MEDICAL,TREATMENT
jaundice iddare hege treat maduvudu,MEDICAL,TREATMENT
vomiting annu treat durne ge lie dava helu,MEDICAL,TREATMENT
pimple annu hege treat maduvudu,MEDICAL,TREATMENT
dengue or malaria na cikitse same ide enu,MEDICAL,TREATMENT
dengue or malaria na treatment same ide enu,MEDICAL,TREATMENT
swineflu or malaria na cikitse same ide enu,MEDICAL,TREATMENT
jaundice ho toh hege cikitse maduvudu,MEDICAL,TREATMENT
does swine flu have a treatment athava illava,MEDICAL,TREATMENT
does corona virus have a treatment athava illava,MEDICAL,TREATMENT
estu samaya agatya ide for treating dengue ,MEDICAL,TREATMENT
estu samaya agatya ide for treating malaria ,MEDICAL,TREATMENT
estu time agatya ide for treating corona ,MEDICAL,TREATMENT
estu time agatya ide dengue na cikitse maduvudakke,MEDICAL,TREATMENT
dengue du cikitse maduvudakke estu time agatya ide,MEDICAL,TREATMENT
malaria na cikitse maduvudakke estu samaya agatya ide,MEDICAL,TREATMENT
is there a treatment for swine flu athava illava,MEDICAL,TREATMENT
is there a treatment for corona virus athava illava,MEDICAL,TREATMENT
is there a treatment for dengue athava illava,MEDICAL,TREATMENT
can pimples be treated ondu dina ralli,MEDICAL,TREATMENT
can pimples be treated chaar dina ralli,MEDICAL,TREATMENT
can jaundice be treated ondu tingalalli ralli,MEDICAL,TREATMENT
can corona be treated ondu tingalalli ralli,MEDICAL,TREATMENT
yava hospital malaria na treatment needutta ide,MEDICAL,TREATMENT
yava hospital dengue na cikitse needutta ide,MEDICAL,TREATMENT
which hospital provides cikitse for corona virus,MEDICAL,TREATMENT
which hospital provides treatment for corona virus,MEDICAL,TREATMENT
yava hospital dengue na cikitse needutta ide,MEDICAL,TREATMENT
yava hospital accomodates and treats jaundice patients,MEDICAL,TREATMENT
yava hospital corona na treatment needutta ide,MEDICAL,TREATMENT
dengue annu prevent maduvudu enu,MEDICAL,PREVENTION
malaria annu prevent maduvudu enu,MEDICAL,PREVENTION
jaundice annu prevent maduvudu enu,MEDICAL,PREVENTION
torisu measures to prevent malaria,MEDICAL,PREVENTION
torisu steps to prevent dengue,MEDICAL,PREVENTION
torisu measures to prevent corona virus from spreading,MEDICAL,PREVENTION
enu steps togollabhaudu to prevent dengue,MEDICAL,PREVENTION
enu measures togollabhaudu to prevent jaundice,MEDICAL,PREVENTION
torisu measures to stop corona from spreading,MEDICAL,PREVENTION
how can we prevent corona na haraduvike,MEDICAL,PREVENTION
how to control corona na haraduvike,MEDICAL,PREVENTION
how to control swine flu na haraduvike,MEDICAL,PREVENTION
navu malaria na haraduvike hege stop maduvudu,MEDICAL,PREVENTION
